{
  "schema": "nogra.run.v2",
  "runId": "run-20260723-example",
  "workspaceId": "example-workspace",
  "briefId": "brief-example",
  "briefHash": "sha256:aaaaaaaaaaaaaaaaaaaaaaaaaaaaaaaaaaaaaaaaaaaaaaaaaaaaaaaaaaaaaaaa",
  "approvalId": "approval-20260723-example",
  "approvalActionHash": "sha256:bbbbbbbbbbbbbbbbbbbbbbbbbbbbbbbbbbbbbbbbbbbbbbbbbbbbbbbbbbbbbbbb",
  "createdAt": "2026-07-23T10:00:01.000Z",
  "updatedAt": "2026-07-23T10:00:01.000Z",
  "startedAt": null,
  "returnedAt": null,
  "verifiedAt": null,
  "acceptedAt": null,
  "endedAt": null,
  "lifecycle": "queued",
  "outcome": null,
  "verdict": null,
  "owner": "Manager",
  "nextOwner": "nogra:executor",
  "target": "executor",
  "targetRole": "executor",
  "targetModel": "sonnet",
  "executionRole": "nogra:executor",
  "executionRuntime": "sonnet",
  "evidenceLevel": "tested",
  "ledgerWatermark": 2,
  "sessionId": "",
  "transcriptId": "",
  "scratchRoots": [],
  "paths": {
    "artifactsDir": ".nogra/transport/artifacts/run-20260723-example",
    "report": ".nogra/transport/artifacts/run-20260723-example/report.md",
    "output": ".nogra/transport/artifacts/run-20260723-example/output.md",
    "validation": ".nogra/transport/artifacts/run-20260723-example/validation.json"
  },
  "artifacts": {
    "reportExists": false,
    "outputExists": false,
    "validationExists": false
  },
  "summary": "",
  "error": "",
  "redactions": []
}
